https://apnews.com/article/china-congress-economy-business-235e75539318bfd89d23aee348bf16da,  Menu Live Trump hush money trial Karen Bass Universal Studios accident Rock Roll Hall of Fame Earth Day Menu Menu World U.S. Election 2024 Politics Sports Entertainment Business Science Fact Check Oddities Health Newsletters Video Photography Climate Personal Finance AP Investigations Tech Lifestyle Religion AP Buyline Personal Finance AP Buyline Shopping Press Releases ... World IsraelHamas War RussiaUkraine War Global elections Asia Pacific Latin America Europe Africa Middle East China Australia U.S. Election 2024 Election Results Delegate Tracker AP Elections Global elections Politics Joe Biden Election 2024 Congress Sports MLB NBA NHL NFL Soccer Golf Tennis Auto Racing 2024 Paris Olympic Games Entertainment Movie reviews Book reviews Celebrity Television Music Business Inflation Personal finance Financial Markets Business Highlights Financial wellness Science Fact Check Oddities Health Newsletters Video Photography Climate Personal Finance AP Investigations Tech Artificial Intelligence Social Media Lifestyle Religion AP Buyline Personal Finance AP Buyline Shopping Press Releases Search Query Submit Search Show Search Business China s plans for 2024 prioritize technology offer scant comfort for businesses and investors 1 of 3 Chinese Premier Li Qiang deliver his opening speech during the opening session of the National People s Congress NPC at the Great Hall of the People in Beijing China Tuesday March 5 2024. AP PhotoAndy Wong  2 of 3 A member of security looks on before the opening session of the The National People s Congress NPC at the Great Hall of the People in Beijing China Tuesday March 5 2024. AP PhotoNg Han Guan  3 of 3 People gather near the portrait of Mao Zedong on Tiananmen Gate to catch a glimpse of the flag raising ceremony ahead of the opening session of the National People s Congress NPC in Beijing China Tuesday March 5 2024. AP PhotoNg Han Guan  1 of 3 Chinese Premier Li Qiang deliver his opening speech during the opening session of the National People s Congress NPC at the Great Hall of the People in Beijing China Tuesday March 5 2024. AP PhotoAndy Wong Chinese Premier Li Qiang deliver his opening speech during the opening session of the National People s Congress NPC at the Great Hall of the People in Beijing China Tuesday March 5 2024. AP PhotoAndy Wong  2 of 3 A member of security looks on before the opening session of the The National People s Congress NPC at the Great Hall of the People in Beijing China Tuesday March 5 2024. AP PhotoNg Han Guan A member of security looks on before the opening session of the The National People s Congress NPC at the Great Hall of the People in Beijing China Tuesday March 5 2024. AP PhotoNg Han Guan  3 of 3 People gather near the portrait of Mao Zedong on Tiananmen Gate to catch a glimpse of the flag raising ceremony ahead of the opening session of the National People s Congress NPC in Beijing China Tuesday March 5 2024. AP PhotoNg Han Guan People gather near the portrait of Mao Zedong on Tiananmen Gate to catch a glimpse of the flag raising ceremony ahead of the opening session of the National People s Congress NPC in Beijing China Tuesday March 5 2024. AP PhotoNg Han Guan  By ELAINE KURTENBACH Updated hourminute AMPM timezone monthFull day year Share Share Copy Link copied Email Facebook X Reddit LinkedIn Pinterest Flipboard Print BEIJING AP China s blueprint for its economy in 2024 is replete with goals and promises but it s also notable for not spelling out specific moves to attain longpromised reforms that foreign businesses and investors have been hoping for. The work report presented Tuesday by Premier Li Qiang to the National People s Congress outlined plans for modest increases in overall spending and a hefty 7.2 jump in funding for the military. The ruling Communist Party s target is to grow the economy by about 5 this year an ambition that economists say may be hard to attain. Li said China also will focus on supporting research and industries to attain breakthroughs in key technologies including computer chips.  Such goals are in line with leader Xi Jinping s aim to strengthen China s selfreliance and power in advanced technologies as Beijing and Washington spar over technology and national security concerns. Li s work report is designed to showcase for the nation achievements in the past year and convey the top leadership s priorities for this year. But it also provides insights into the direction of policies that affect both domestic and foreign companies.   IMF s Georgieva says there s plenty to worry about despite recovery for many economies IMF Outlook for world economy is brighter though still modest by historical standards China s economy grew 5.3 in first quarter beating expectations though weak spots remain The speech did little to address concerns that have led foreign businesses to reconsider their investment strategies in China said James Zimmerman a lawyer and former head of the American Chamber of Commerce in Beijing.  Apart from the ambitious growth target There is no reform no liberalization no action plan and no messaging of reassurance he said. One can only guess that the strategy is to stay the course and hope that things will correct themselves.  A decision to cancel the annual news conference by the premier that usually wraps up after the congress finishes has added to a sense of diminishing transparency he said.  Tianchen Xu of the Economist Intelligence Unit said the report mostly reiterated what the government has been saying for the past six to nine months. What s needed are moves to liberalize investment in telecommunications and healthcare for example or laws to ensure private businesses are able to collect on unpaid debts.   The key is that strong commitments need to be matched by actions we haven t seen much progress so far Xu said in an emailed comment. Chinese markets have languished in recent months and shares in Hong Kong fell on heavy selling of technology stocks Tuesday with the benchmark Hang Seng index sinking 2.6.  Ecommerce giant Alibaba lost 3.3 Baidu fell 5.7 and JD.com another major ecommerce company lost 7.5.   There was little surprise that the GDP growth target was set at around 5 again as lowering the target would have further weakened confidence Lynn Song chief economist for Greater China at ING Economics said in a report. She noted that some of the postpandemic help for the economy will be missing this year and exports may not be much help with forecasts for global demand to be below average.   With that said it will be a more challenging path to repeating 5 growth in 2024 she said. While we saw some positive signals in the government work report a road to restoring confidence will likely take some time and the process will likely be uneven.   China will encourage consumers to scrap old appliances and trade in their cars for electric vehicles and other new products to help spur more domestic demand.  The government will boost spending on research and development by 10.   Military spending is due to increase by 7.2 in line with the previous year s rate of growth to 1.67 trillion yuan 232 billion.   The government will issue 1 trillion yuan 139 billion in ultra longterm special bonds in this year and coming years to support major national strategies and build security capacity in key industries.  Another 10.4 billion yuan 1.4 billion will go to upgrading industries and modernizing manufacturing. The report also said China will encourage more venture capital and equity investment and use marketbased measures to promote faster development of computer chip manufacturing and advanced information technology.   We will work to build China s selfreliance and strength in science and technology the report said.  The report which is due to be endorsed by the congress when it wraps up next week sets a goal of reducing China s energy consumption this year by 2.5 and moving toward carbon neutrality in reducing emissions that contribute to climate change.   We will support a new round of strategic initiatives aimed at breakthroughs in mineral exploration promote the development of clean and renewable energy and facilitate faster progress in building a new energy system it said.,
https://www.cnbc.com/2024/03/11/key-takeaways-from-2024-china-parliamentary-meeting-economy-environment.html, BEIJING China s weeklong annual parliamentary meetings ended on Monday and for the first time in decades the Chinese premier did not host a press conference. In a break with tradition the premier will no longer hold a press conference following this year s parliamentary meetings at least for the rest of the term according to an official announcement last week. Such press conferences were a rare instance of press interaction with the highest levels of China s government. President Xi Jinping did not speak at the closing ceremony. He typically speaks only at the closing ceremonies of the first session of each National People s Congress the nation s highest authority which is elected every five years. This year is the second session of the 14th National People s Congress. To be clear the annual gathering of the top leadership is typically ceremonial in nature. The real power lies with the ruling Communist Party which is headed by Xi who is general secretary of the party and president of China. Still announcements made during the Congress can shed some light on government policy. Here are some highlights of what was announced at this year s weeklong parliamentary meeting which started Tuesday last week and ended Monday.  Along with the extensive discussions on environmental protection the Government Work Report GWR explicitly pledged to lower energy consumption per unit of GDP by around 2.5 in 2024 Citi analysts pointed out in a report Sunday. The report didn t set such numeric targets in 202223 after the 3.0 target and campaignstyle execution led to the power outages in 2021 the analysts said. But they warned that investors need to be mindful of the growth risks arising again from potential environmental policy tightening.  China has set a 2024 growth target of around 5 Premier Li Qiang at the start of the meetings on Tuesday when he released the muchanticipated government work report. Industrial support clearly ranked first on Beijing s priority list for the year ahead according to three major plans released as part of the parliamentary meetings. The top economic planner also noted how a push to upgrade equipment would generate a market of more than 5 trillion yuan about 694.5 billion. However the Minister of Housing and UrbanRural Development said property developers that must go bankrupt should go bankrupt. In a press conference on Saturday Ni Hong warned that those who harm the interests of the masses will be probed and punished. The Chinese Communist Party has increased its oversight of the government under Xi. At the 2023 parliamentary meeting Beijing announced an overhaul of finance and tech regulation by establishing partyled commissions to oversee the two sectors. Xi also gained an unprecedented third term as president at last year s meeting. This year the National People s Congress rubber stamped changes to revise the structure of the State Council which has been the government s top executive body led by the premier. At the ceremonial closing on Monday the amended State Council Organic Law passed with 2883 delegate votes with eight rejecting the amendments and nine abstentions. The changes include vice premiers and the head of the People s Bank of China among the council s top leadership group. It was not immediately clear what impact such changes would have.  CNBC s Clement Tan contributed to this story. Sign up for free newsletters and get more CNBC delivered to your inbox Get this delivered to your inbox and more info about our products and services.  2024 CNBC LLC. All Rights Reserved. A Division of NBCUniversal  Data is a realtime snapshot Data is delayed at least 15 minutes. Global Business and Financial News Stock Quotes and Market Data and Analysis.  Data also provided by,
https://www.piie.com/blogs/realtime-economics/2024/chinas-2024-budget-turns-expansionary-will-it-be-fully-spent, This website is using a security service to protect itself from online attacks. The action you just performed triggered the security solution. There are several actions that could trigger this block including submitting a certain word or phrase a SQL command or malformed data. You can email the site owner to let them know you were blocked. Please include what you were doing when this page came up and the Cloudflare Ray ID found at the bottom of this page.  Cloudflare Ray ID 878716c84ddf1353 Your IP Click to reveal 26015cf407f36b0e19c659e41a36d52 Performance security by Cloudflare ,
https://apnews.com/article/china-congress-legislature-takeaways-76ee304ab3fcafb45c0af9a2968e8d5d,  On Now 042 China s economic growth target for 2024 set at around 5 AP Explains China s economic growth target for this year is around 5 in line with last year s performance despite forecasts for a slowdown. Chinese Premier Li Qiang announced the plans Tuesday Mar. 5 before the National People s Congress. The ruling Communist Party has said it is prioritizing efforts to encourage consumer spending to help drive the economy. AP video Tian Macleod Ji Mar. 5 China s economic growth target for this year is around 5 in line with last year s performance despite forecasts for a slowdown. Chinese Premier Li Qiang announced the plans Tuesday Mar. 5 before the National People s Congress. The ruling Communist Party has said it is prioritizing efforts to encourage consumer spending to help drive the economy. AP video Tian Macleod Ji Mar. 5  On Now 043 China raises defense budget amid regional tensions and push for global clout AP explains China announced a 7.2 increase in its defense budget which is already the world s secondhighest behind the United States at 1.6 trillion yuan 222 billion roughly mirroring the rise of the last year. AP video Wayne Zhang China announced a 7.2 increase in its defense budget which is already the world s secondhighest behind the United States at 1.6 trillion yuan 222 billion roughly mirroring the rise of the last year. AP video Wayne Zhang  1 of 8 Chinese President Xi Jinping applauds during the opening session of the National People s Congress NPC at the Great Hall of the People in Beijing China Tuesday March 5 2024. AP PhotoNg Han Guan Chinese President Xi Jinping applauds during the opening session of the National People s Congress NPC at the Great Hall of the People in Beijing China Tuesday March 5 2024. AP PhotoNg Han Guan  2 of 8 Chinese President Xi Jinping left talks with Chinese Premier Li Qiang during the opening session of the National People s Congress NPC at the Great Hall of the People in Beijing China Tuesday March 5 2024. AP PhotoNg Han Guan Chinese President Xi Jinping left talks with Chinese Premier Li Qiang during the opening session of the National People s Congress NPC at the Great Hall of the People in Beijing China Tuesday March 5 2024. AP PhotoNg Han Guan  3 of 8 Chinese Premier Li Qiang center speaks during the opening session of the National People s Congress NPC at the Great Hall of the People in Beijing China Tuesday March 5 2024. AP PhotoNg Han Guan Chinese Premier Li Qiang center speaks during the opening session of the National People s Congress NPC at the Great Hall of the People in Beijing China Tuesday March 5 2024. AP PhotoNg Han Guan  4 of 8 A conductor leads the military band as they perform a national anthem during the opening session of the National People s Congress NPC at the Great Hall of the People in Beijing Tuesday March 5 2024. China on Tuesday announced a 7.2 increase in its defense budget which is already the world s secondhighest behind the United States at 1.6 trillion yuan 222 billion roughly mirroring the rise of the last year. AP PhotoAndy Wong A conductor leads the military band as they perform a national anthem during the opening session of the National People s Congress NPC at the Great Hall of the People in Beijing Tuesday March 5 2024. China on Tuesday announced a 7.2 increase in its defense budget which is already the world s secondhighest behind the United States at 1.6 trillion yuan 222 billion roughly mirroring the rise of the last year. AP PhotoAndy Wong  5 of 8 Chinese President Xi Jinping left and Chinese Premier Li Qiang arrive for the opening session of the National People s Congress NPC in Beijing China Tuesday March 5 2024. AP PhotoNg Han Guan Chinese President Xi Jinping left and Chinese Premier Li Qiang arrive for the opening session of the National People s Congress NPC in Beijing China Tuesday March 5 2024. AP PhotoNg Han Guan  6 of 8 Delegates read the opening remark by Chinese Premier Li Qiang during the opening session of the National People s Congress NPC at the Great Hall of the People in Beijing China Tuesday March 5 2024. AP PhotoAndy Wong Delegates read the opening remark by Chinese Premier Li Qiang during the opening session of the National People s Congress NPC at the Great Hall of the People in Beijing China Tuesday March 5 2024. AP PhotoAndy Wong  7 of 8 Chinese President Xi Jinping right chats with Foreign Minister Wang Yi as he leaves after the opening session of the National People s Congress NPC at the Great Hall of the People in Beijing China Tuesday March 5 2024. AP PhotoNg Han Guan Chinese President Xi Jinping right chats with Foreign Minister Wang Yi as he leaves after the opening session of the National People s Congress NPC at the Great Hall of the People in Beijing China Tuesday March 5 2024. AP PhotoNg Han Guan  8 of 8 A delegates leaves the hall after Chinese Premier Li Qiang delivered his work report at the opening session of the National People s Congress NPC at the Great Hall of the People in Beijing Tuesday March 5 2024. China s official growth target for this year is around 5 Premier Li Qiang said Tuesday in an annual report on the government s plans and performance that prioritized both security and the economy. AP PhotoAndy Wong A delegates leaves the hall after Chinese Premier Li Qiang delivered his work report at the opening session of the National People s Congress NPC at the Great Hall of the People in Beijing Tuesday March 5 2024. China s official growth target for this year is around 5 Premier Li Qiang said Tuesday in an annual report on the government s plans and performance that prioritized both security and the economy. AP PhotoAndy Wong BEIJING AP China s Premier Li Qiang promoted an image of confidence as he announced modest economic growth goals for the world s second largest economy at one of the country s most important political gatherings. Li addressed a few thousand delegates of the country s rubberstamp legislature the National People s Congress which met in Beijing. It s a time when the government reviews the work of the past year and crucially reveals targets and goals for the coming year especially in its approach to its economy military budget and Chinese society.  Chinese leaders and delegates attend the opening session of the Chinese People s Political Consultative Conference in the Great Hall of the People in Beijing Monday March 4 2024. AP PhotoTatan Syuflana Here are some key takeaways from Li s address Tuesday.  The government s overall approach to the economy will not change as the goals by the government for 2024 signal that they want to stabilize growth. Li announced that the GDP growth target was 5 this year a modest target that is still going to be difficult. China is grappling with an economic slowdown and a real estate market in crisis after a crackdown on excess borrowing led to a liquidity crisis among developers.  This year s targets are virtually the same as last year reflecting policy stasis in Beijing as the central leadership delays any significant economic policy decisions until the Third Plenum later in the year said Neil Thomas a fellow on Chinese Politics at the Asia Society.   Philippine and Chinese vessels collide in disputed South China Sea and 4 Filipino crew are injured China sets an economic growth target of around 5 but acknowledges it will not be easy to achieve China in a surprise announcement says it is eliminating an annual news conference by the premier TOUGHER LANGUAGE ON TAIWANLi s report had stronger language on Taiwan a selfruled island that China considers its own.  Missing from this year s report was the word peace. Last year the premier had called for advancing the process of China s peaceful reunification. This year Li said they will be firm in advancing the cause of China s reunification.  Overall the language this year was tougher said Arthur ZhinSheng Wang a professor at Taiwan s Central Police University who s an expert on crossStraits relations. Dropping the word peace combined with the phrase resolutely opposing Taiwan independence is what signals a stronger stance Wang said. Last year the work report had more language about promoting the prosperity of both sides as well while this year only had a brief nod.   Chinese President Xi Jinping right chats with Foreign Minister Wang Yi as he leaves after the opening session of the National People s Congress NPC at the Great Hall of the People in Beijing China Tuesday March 5 2024. AP PhotoNg Han Guan Taiwan held presidential elections in January and elected Lai Chingte to be its next president giving the Democratic Progressive Party a third term. The party s platform maintains that Taiwan is already independent of China.  Taiwan and China have been ruled separately since 1949 when the Nationalist government of Chiang Kaishek retreated to the island after losing a civil war on the mainland to Mao Zedong s communist forces. The government announced an increase of 7.2 in the military budget the world s secondhighest behind the United States at 1.6 trillion yuan 222 billion. China s defense budget has more than doubled since 2015 but in recent years it has dialed down the increase in defense spending as economic growth slowed.   China demands the US stop any official contact with Taiwan following a congressional visit Philippines urges neighbors to stand together more strongly against China in the South China Sea MIGRANT WORKERSChina s rural and urban populations have long been divided by the hukou a registration and identification system through which social benefits are allocated such as health insurance and schools. Cities and urban areas generally have better social benefits than rural ones. For the first time in recent years the government s work report mentioned that it would want to make it easier for migrant workers with rural hukou registrations to be able to change their hukous to urban ones. While hukou reform has long been discussed the mention in the government report signals that it could be higher on the agenda of the central authorities.  Delegates leave after the opening session of the The National People s Congress NPC at the Great Hall of the People in Beijing China Tuesday March 5 2024. AP PhotoAndy Wong In spite of the slowing economy and U.S. export controls on several techrelated industries such as semiconductors Li struck a note of confidence in his report.   The Chinese people have the courage wisdom to overcome any difficulties or obstacles he said. China s development will surely endure storms and plough through the waves and the future is promising.  AP news researchers Yu Bing and Wanqing Chen contributed to this report.   The Associated Press is an independent global news organization dedicated to factual reporting. Founded in 1846 AP today remains the most trusted source of fast accurate unbiased news in all formats and the essential provider of the technology and services vital to the news business. More than half the world s population sees AP journalism every day. The Associated Press ap.org Careers Advertise with us Contact Us Accessibility Statement Terms of Use Privacy Policy Cookie Settings Do Not Sell or Share My Personal Information Limit Use and Disclosure of Sensitive Personal Information CA Notice of Collection More From AP News About AP News Values and Principles AP s Role in Elections AP Leads AP Definitive Source Blog AP Images Spotlight Blog AP Stylebook Copyright 2024 The Associated Press. All Rights Reserved.,
