4,23,2024,13,24
https://stephenhalbrook.com/second-amendment-post-sniper-policy/, by Stephen P. HalbrookNational Law Journal Nov. 11 2002 and New Jersey Law Journal Nov. 18 2002 The terror spread by the Washington D.Carea snipers has prompted two reactions. One is to enact laws for ballistic fingerprinting of all firearms and to ban sniper rifles. The other is to focus on how to identify apprehend and sentence such terrorists to death. The rampage took place at a unique time in the guncontrol debate. The Sept. 11 hijackers proved that terrorists don t need firearms. The cry Let s roll! on United Flight 93 rendered pass the doctrine of nonresistance to criminality and sparked the widespread call that airline pilots be armed. Democrats have learned the perils of advocating gun control. The Clinton administration argued that only a collective state power to a militia is guaranteed by the Second Amendment. But Al Gore lost key states to unhappy hunters. Just after Sept. 11 2001 the Fifth U.S. Circuit Court of Appeals decided U.S. v. Emerson ruling for the hunters that the Second Amendment protects the right of individuals to privately keep and bear their own firearms that are suitable as individual personal weapons.  The Department of Justice under Attorney General John Ashcroft has argued that the amendment broadly protects the rights of individuals to possess and bear their own firearms excluding possession by unfit persons and firearm types particularly suited to criminal misuse.  That brings us to John Allen Muhammad and Lee Malvo. The harshest critics of Ashcroft s views on the amendment blame the sniper attacks on the lack of common sense gun control. The Brady Campaign to Prevent Gun Violence has claimed that ballistic fingerprinting would have solved this crime after the first shooting. The Violence Policy Center urged that tougher restrictions must be placed on socalled sniper rifles such as the .50 .308 and .223 calibers and Rep. John Conyers DMich. wrote in a letter to the Federal Trade Commission that sniper rifles are designed to strike a target from a distance.  But it is unclear how a sniper rifle is different from a hunting rifle. Since only one shot was fired in each of the murders any type of rifle could have been used. In fact it was a Bushmaster XM15 semiautomatic. While that rifle is not an assault weapon as defined by federal law the killing spree is being used to argue for reenactment of the federal assault weapon ban which sunsets in 2004. The serial sniper also revived S. 3096 a bill sponsored by Senator Herb Kohl DWis. that would require ballistics testing of all new firearms. The images of the bullet and cartridge casings would go into a computerized database. The effectiveness of the bill would be largely illusory however unless it included the 260 million firearms already out there and their owners identities including those owned by criminals. Moreover fingerprints do not change but bullets deform and shell casings change with normal use and parts replacement and intentional alteration. While ballistics testing may be useful when limited to actual crime guns the Bureau of Forensic Services of the California Justice Department has warned that if samples from all firearms are imaged this number of candidate cases will be so large as to be impractical.  Maryland and New York have enacted laws requiring ballistic imaging for all new handguns sold with no practical results. More intensive investigation of suspected terrorists would be a more productive place to start. According to reports John Allen Muhammad praised the Sept. 11 hijackers and made terrorist threats. His friend Harjett Singh disclosed these plans in June to police and the FBI apparently to no avail. During the killing spree police searched white vans and knocked on the doors of thousands in Maryland who had bought .223 rifles to demand them for testing. Meanwhile the sniper cruised around in a blue Chevy sedan with a rifle from the West Coast. Finally the oldfashioned gumshoe approach of pinpointing specific suspects paid off. It is doubtful that hunting rifles will be banned as a result of the sniper case and it is certain that ballisticimaging plans will be thoroughly studied. But what drives some to commit heinous murders will probably remain a mystery of the human condition. One thing is certain Further criminalization of what peaceable firearm owners perceive to be their Second Amendment rights will have no effect on killers serial or otherwise. Email sphalbrook at gmail.comInstagram stephenhalbrook
https://yipinstitute.org/article/why-we-should-ban-assault-rifles, email protected Inquirydriven this article reflects personal views aiming to enrich problemrelated discourse.  Our father Eugene Stoner designed the AR15 and subsequent M16 as a military weapon to give our soldiers an advantage over the AK47 Stoner s children said in an interview with NBC News. He died long before any mass shootings occurred. But we do think he would have been horrified and sickened as anyone if not more by these events. Their sentiment is mirrored by millions of Americans who have become increasingly more accustomed to turning on their news only to see horrifying footage of yet another mass shooting. According to a 2019 Gallup article approximately 60 percent of Americans are in favor of an assault rifle ban similar to the one that existed in the United States U.S. from 1994 to 2004. However when weighing this issue there are more points to consider than simply popular support. After reading this article the effectiveness and need for an assault rifle ban will become evident and the legitimacy of an array of common oppositions to this statement will be cast into severe doubt. Many informed citizens on this topic may have picked up on the fact that in the initial example a quote from the inventor of the AR15 is cited a gun that is not officially recognized as an assault rifle. This is due to the fact that this article critiques a piece of legislation that not only bans legitimate assault rifles but also prohibits the sale of all semiautomatic shotguns and rifles that are capable of holding more than 10 rounds as cited from WUSF News. This distinction is important to keep in mind as when considering this case we must look at shootings involving guns like the AR15 not just official assault rifles such as the M16. Semiautomatic weapons are much more commonly used in mass shootings and must be immediately banned. When considering the assault rifle ban detractors will often cite that the majority of the U.S. nearly 40000 annual gun deaths involve handguns and not assault rifles thus showing that assault rifles are not important enough to be banned. The facts however show that the real issues lie in the ability of assault rifles to cause mass indiscriminate death. Of the 28 deadliest mass shootings in recent U.S. history all but two used some form of semiautomatic weapon that would under a formal assault rifle ban such as the one passed in 1994 be banned. A true eyeopener to the devastating nature of these guns was the 2017 Las Vegas shooting which left 58 dead and 422 injured. The use of bump stock equipped semiautomatic rifles in conjunction with sniper rifles in this deadly killing truly shows the ability for any deranged man woman or teenager to acquire a weapon and use it to slaughter people who they had no qualms with. As American vetran Michael Diamond wrote Assault rifles are uniquely lethal because they re designed to kill as many humans as possible as quickly as possible.  Once one acknowledges that this assault rifle ban would take unnecessarily dangerous weapons off the streets they are met with the dilemma of whether or not any positive change would be brought to the status quo. Luckily for Americans there is a clear example for us to base our research off of. The 1994 Assault Weapons Ban had mixed results partially due to the fact that the plan contained numerous grandfathering provisions that would have taken longer to integrate. One conclusion however has been conclusively drawn So using that as a very tentative guide that s high enough to suggest that eliminating or greatly reducing crimes with these magazines could produce a small reduction in shootings likely something less than 5 percent. Now we should note that effects of this magnitude could be hard to ever measure in any very definitive way but they nonetheless could have nontrivial notable benefits for society Christopher Koper said in his immersive report on the topic. Consider for example at our current level of our gun violence achieving a 1 percent reduction in fatal and nonfatal criminal shootings would prevent approximately 650 shootings annually And of course having these sorts of guns and particularly magazines less accessible to offenders could make it more difficult for them to commit the sorts of mass shootings that we ve seen in recent years. This statement is mirrored by the fact that of the 25 mass shootings with over 10 victims that occurred in the 39 year time frame between 1982 and 2020 a grand total of only two occurred between 1994 and 2004. Only one of these two mass shootings used a semiautomatic weapon with the other being committed with a normal pistol. When debating this topic gun advocates will often bring up points such as mass shootings kill only a fraction of people as compared to car accidents assault weapons make up a small portion of gun deaths criminals will still get guns illegally and restricting the access to guns is unconstitutional. Amongst the first two contentions I would ask why this is relevant. Assault weapon homicides are clearly an issue and unlike most systemic problems there is a clear path to minimizing this. Acknowledging this issue and yet not acting would be equivalent to if the government noticed that 300 kids were dying every year due to a lack of seat belts but decided that it was not a large enough issue to tackle. When considering human life all precautions should be taken to prevent death while maintaining freedoms.  When considering the third contention it is important to keep the statistics in mind. Of the 98 recent mass shootings where whether the gun was purchased legally or illegally is confirmed only about 16 percent of the cases involved the latter. While one should not assume that this means that we will see an 84 percent decline in mass shootings if we put in place the proposed ban it is logical to presume that these tragic events would occur at much lower rates than the status quo. Through the presented information it should be clear that assault weapons are unnecessarily dangerous and that normal people should not be able to acquire them the same way civilians are not permitted to assemble their own nuclear weapons. When America s Founding Fathers signed the U.S. Constitution they did not intend for the Second Amendment to allow mentally troubled teenagers to murder their classmates in cold blood rapists to shoot up churches or racists to open fire on vulnerable minorities. There is no reason to protect the unnecessarily violent assault weapons that lead to excessive death and suffering and America should take steps to get these guns off our streets. Hey my name is Dhruv Gupta and I m a 17 year old from California. I enjoy writing satire for YIP and also serve as the organization s Director of Technology. I also love to stay educated on the new and contentious topics. The discourse surrounding the welfare state in the US and the Western world writ large has undoubtedly shifted rightward since the 1980s. There are many reasons for this but the biggest one is the myth of welfare dependency. My goal here is to critically examine the concept of welfare dependency itself and challenge its characterization as a real issue. The purpose is not to deny that welfare fraud exists or that stealing is good but rather that government intervention to protect people and grow the economy is justified even if it costs more and that rightwing arguments on the topic are fundamentally flawed. One of Asia s most important diplomatic wars is being waged somewhere else entirely the South Pacific. Taiwan is on the defensive as China gradually wins over its allies with economic aid while the United States concerns itself with the struggle s implications for its own position in the region. You ve been elected leader of your country. What would you say during your inaugural address to inspire the citizens of your country including those of every race religion political party and creed?
https://www.vox.com/2016/7/9/12128686/vox-gun-image-survey-ban-firearms, According to our research the types used in those very attacks. Vox and Morning Consult conducted a national survey in which 2000 people were asked whether they thought certain rifles handguns and shotguns should be legal based solely on the appearance of the gun. Participants were shown the names and pictures of 11 firearms and asked whether they thought the gun should be illegal then whether they thought it actually was illegal in the US. The results showed that a high majority of people about 70 percent were in favor of small handguns like the flare gun the .44 Magnum and the Taurus 605 being legal. The same could be said for the Golden Boy Rifle and the Montefeltro. However only a small minority 10 to 20 percent felt that assault weapons like the AK47 the Uzi and the MG3 should be legal. Perhaps unsurprisingly Republicans were more likely than Democrats to say that each gun should be legal by about 20 percentage points. For example about 80 percent of Republicans said the Golden Boy rifle should be legal compared with 59 percent of Democrats. Among Democrats 20 percent said all 11 guns should be illegal while 15 percent of Republicans said they should all be legal. Men overall were more likely to say each gun should be legal by about 10 percentage points. The second part of the survey asked respondents about the current legality of each gun. States have different rules when it comes to which firearms are banned for example the AK47 is legal to purchase in Idaho but illegal in California. Seven states California Connecticut Hawaii Maryland Massachusetts New Jersey and New York and the District of Columbia have laws banning the purchase or carrying of assault weapons. Minnesota and Virginia also regulate but do not ban assault weapons. For example someone who has committed a violent crime cannot buy an assault weapon in Minnesota regardless of whether the crime was committed in the state. AK47s Uzis and MG3s generally fall under such bans and regulations. When asked whether each gun was legal in the US most people polled were able to accurately say which handguns were legal but they were not as sure with rifles. Overall men were more familiar with the legality of each gun. Will you support Vox today?  We believe that everyone deserves to understand the world that they live in. That kind of knowledge helps create better citizens neighbors friends parents and stewards of this planet. Producing deeply researched explanatory journalism takes resources. You can support this mission by making a financial gift to Vox today. Will you join us?   5month   10month   25month   50month   We accept credit card Apple Pay and Google Pay. You can also contribute via  Oops. Something went wrong. Please enter a valid email and try again. Oops. Something went wrong. Please enter a valid email and try again.
