4,23,2024,14,8
https://www.insidehighered.com/views/2022/10/26/government-should-stop-propping-profits-opinion, By Terry Vaughan IIIand Nicole Brunt You have 5 articles left.Sign up for a free account or log in. The federal government should at least do no harm when it comes to helping students attain a college degree. Instead through student loans our tax money is used to prop up institutions that are more predatory than educational forprofit educational institutions. These institutions charge their mostly lowincome students so much for so little that the federal government s involvement amounts to exploitation. Too often these institutions aim to make money ahead of their duty to educate students. Their aggressive sales tactics convince vulnerable individuals to sink into debt for a degree that is less usable and more expensive than an equivalent degree from a community college or fouryear institution. That is if students attain a degree at all. The fact is most don t. Only 30.7 percent students entering fouryear forprofit institutions complete their degrees in six years. Their education is often a failed promise. By contrast 48.7 percent of students at public fouryear institutions and 58.5 percent of students at private nonprofit fouryear institutions complete their degrees within six years. The numbers are even worse for Pell Grant receipts who enter fouryear forprofit institutions 27.9 percent of whom complete their degrees in six years. These dismal outcomes are more troubling because many of these students are low income or first generation often coming from families with little or no college experience. Forprofit colleges disproportionately enroll recipients of federal grants including Pell Grants. Of all the students attending fouryear forprofit institutions in 2019 20 69.2 percent were federal grant recipients. This is about 20 percentage points higher than the proportion of students receiving federal grants at public fouryear institutions. Marketing ploys convince students with fewer resources or little family support to attend forprofit institutions. They see the promised education as the key to entering the middle class. Yet all too often all those students attain from the experience is eyepopping debt that makes them worse off financially not better. Students at fouryear forprofits borrow far more than those at fouryear nonprofit institutions. About 87 percent of students who graduated in 2015 16 with bachelor s degrees from forprofit colleges took out student loans compared to 66 percent at public institutions among those borrowers at forprofit institutions the average borrowed for bachelor s degree completers was 44610 compared to 34430 at private nonprofits and 29070 at public nonprofits. The cost is breathtaking. Too many of these students fall into enormous debt for a substandard education. Yet our government continues to allow 704 forprofit institutions in our nation to administer student loans to the 787811 students who attend. Our tax money should not be used this way. The federal government should pull out of giving students loans to attend forprofit colleges. These institutions are not providing a public service and their outcomes and degreeattainment data have proven that the government should not support costly speculative higher education institutions when students lives are on the line. At the minimum the government should develop stricter laws and regulations based on the success of the few forprofit institutions that do get it right. Forprofits will object to ending student loans for their institutions. They will say that they are marketdriven more flexible than traditional colleges and offer students practical classroom learning to enable them to work in the real world. They may even say that their marketbased approach will inspire creativity efficiency and effectiveness to satisfy shareholders and consumers. But if they are so marketdriven and proud of their role in our capitalist system they shouldn t need the federal government to continue to prop them up with student loans. They shouldn t rely on making money by trapping students in debt. They should be entirely marketdriven and make money on the strength of their product like every other business in America. As we all know if your product fails your business will close. Let these forprofit colleges stand or fail on their own merits without federal help. The federal government has acted to forgive student loan debt from students who attended defunct forprofit institutions. However continuing subsidies to enable other forprofit institutions to continue failing students is an insult to taxpayers. It is also a gross disservice to students who only wish to better themselves through education. It s time the government stood with students not those who exploit them. Columbia cancels inperson classes as proPalestinian protests continue on and off campus. AI could free up faculty time to focus on the teaching and relationshipbuilding that matter most Jos Antonio Bowen Colleges are extending admission commitment deadlines due to FAFSA delays but there s no good reason they can t do t The Seder liturgy reminds us that too many colleges are creating students who don t know how to ask a question Rache Subscribe for free to Inside Higher Ed s newsletters featuring the latest news opinion and great new careers in higher education delivered to your inbox. View Newsletters Copyright 2024 Inside Higher Ed All rights reserved. Website designed by nclud MenuFind a JobBecome a MemberSign up for NewslettersNewsFaculty IssuesCurriculumTeachingLearning AssessmentDiversity EquityCareer DevelopmentTenureRetirementLabor UnionizationShared GovernanceAcademic FreedomResearchBooks PublishingStudentsAcademicsRetentionFinancial AidCareersResidential LifeAthleticsFree SpeechPhysical Mental HealthSafetyDiversityRace EthnicitySex GenderSocioeconomicsReligionDisabilityAgeAdmissionsTraditionalAgeAdult PostTraditionalTransferGraduateTech InnovationTeaching LearningArtificial IntelligenceDigital PublishingData AnalyticsLibrariesAdministrative TechAlternative CredentialsBusinessFinancial HealthCostCuttingRevenue StrategiesAcademic ProgramsPhysical CampusesMergers CollaborationFundraisingInstitutionsResearch UniversitiesRegional Public UniversitiesCommunity CollegesPrivate Nonprofit CollegesMinorityServing InstitutionsReligious CollegesWomen s CollegesSpecialized CollegesForProfit CollegesGovernanceExecutive LeadershipTrustees RegentsState OversightAccreditationGovernmentPolitics ElectionsSupreme CourtStudent Aid PolicyScience Research PolicyState PolicyColleges LocalitiesWorkplaceEmployee SatisfactionRemote Flexible WorkStaff IssuesGlobalStudy AbroadInternational Students in U.S.U.S. Colleges in the WorldOpinionViewsIntellectual AffairsCareer AdviceSeeking a Faculty JobAdvancing in the FacultyTeachingSeeking an Administrative JobAdvancing as an AdministratorDiversityBlogsBeyond TransferCall to ActionConfessions of a Community College DeanHigher Ed GammaHigher Ed PolicyJust Explain It to Me!Just VisitingLaw Policy and IT?Leadership StratEDgyLeadership in Higher EducationLearning InnovationOnline Trending NowResident ScholarUniversity of VenusLettersHubsStudent SuccessStudent VoiceAcademic LifeHealth WellnessThe College ExperienceLife After CollegeSpecialPodcastsThe KeyAcademic MinuteCampusThe PulseWeekly WisdomReports DataEventsQuick TakesSolutionsAdvertising MarketingConsulting ServicesData InsightsHiring JobsEvent PartnershipsCampus MembershipMorePost a JobCampusAdvertiseAboutContact Us45 Articles remainingthis month.
https://usafacts.org/articles/what-do-universities-do-with-the-billions-they-receive-from-the-government/, We frequently add data and were interested in what would be useful to people. If you have a specific recommendation you can reach us at email protected. We are in the process of adding data at the state and local level. Sign up on our mailing list here to be the first to know when it is available. Federal investments in universities affected over 3000 schools including 17.5 million graduate and undergraduate students.  Updated on Tue March 28 2023 by the USAFacts Team In 2018 federal money made up 14 of all college revenue. About 3.6 of total federal spending went towards higher education investments according to the US government s Datalab. Datalab operates under the Department of Treasury and is a public source for federal spending data. Colleges and universities received 1.068 trillion in revenue from federal and nonfederal funding sources in 2018. The federal government directed 65 of its 149 billion investments to federal student aid which covers scholarships workstudy and loans given to students for their educational expenses. Federal grants at universities received 27 of the total investment or 41 billion from the federal government in 2018. Grants are a form of financial assistance given to individuals or organizations to fund research and projects that contribute to the public good according to Datalab. The last 8 of federal investment in higher education was for contracts. Federal contracts are agreements where the government purchases a good or service from an organization such as a university or an individual for government use. Federal grants often fund university research and development labs. Public institutions typically report Pell grants as revenues from federal grants and as allowances that reduce tuition and fee revenue. Private institutions typically report Pell grants as revenues from tuition and fees rather than as federal grant revenue according to the Department of Education. Outside of financial aid to help college students pay for educational expenses government agencies fund research and development through university laboratories and special departments. Medicine environment agriculture and general science and technology are a few examples of fields federal government agencies fund via contracts and grants. Unbiased datadriven insights in your inbox each week The National Science Foundation awarded 11.2 billion to universities the second largest federal investment in higher education institutions in the 20182019 school year. Most of the grant money went towards expanding science engineering and mathematics education and research according to Datalab. A little less than half of all federal grant money was for university medical research and development. Biomedical research and research training was the largest funded medical research and development category in 2018 followed by aging research. Harvard University received the largest federal grant 179 million from the National Institute of Health. Columbia University received the second largest grant 165 million invested from the Centers for Disease Control and Prevention. Over 30 of federal contracts were dedicated to space research and development projects. California Institute of Technology received 2.4 billion in federal contract funding from NASA. This federal contract with California Institute of Technology was 24 of all federal investments in government contracts with universities. Hawaii Alaska and Vermont public universities had the largest revenues from federal grant and contract investments per student enrolled in public colleges and universities according to the Department of Education. California Texas and Michigan public universities were the top recipients of federal grant and contract money in 2018 receiving a quarter of federal grant and contract revenue across all public universities. Learn more about higher education and which states are the most educated. Get the data directly in your inbox by signing up for our newsletter. Education Education Education Newsletter USAFacts is a notforprofit nonpartisan civic initiative making government data easy for all Americans to access and understand. Contact UsPrivacy PolicyTerms of ServiceSIGN UP FOR THE NEWSLETTERCloseNewsletter
https://www.lovetoknow.com/parenting/adulting/should-governments-help-pay-college,  Learn about our Editorial Policy.  Should government money be invested in the future? How would you answer the following question should governments help pay for college? This is a controversial issue not only in education but also in economics. Most adults who are returning to college would leap at the opportunity of a governmentsubsidized education. However students fresh out of high school might not recognize the benefit of governmentfinanced classes and create frivolous costs.  On the yes side of the argument education is the only way to maintain a technological and developmental advantage over other nations. Higher education equals higher salaries and more opportunities. The problem is that the average cost of higher education is 87000 to 115000 for four years at a state university. Graduate programs will increase the cost and these figures are based on 2006 estimates each year the cost continues to rise.  While taxpayers would carry the burden initially government support of a college education can help eliminate the need for welfare. It can also help reduce the levels of family or classrelated poverty. Children of college graduates typically attend college. The average family cannot afford the constantly rising cost of college unless the parents themselves are college graduates.  Taxpayers support the education of convicted criminals who undergo rehabilitation in prison earn high school and college degrees and may even graduate law school while behind bars. If the government can pay for a criminals education shouldnt the government pay for the education of people who have never committed a crime?  College educations are optional and it takes a family and a community to create the right situation for students to go to college. Numerous scholarship opportunities along with grants and student loans are available. Students who receive a free ride are also less likely to value the education versus having to work for it. This is an unfortunate byproduct of human nature. Many selfmade millionaires made their fortunes without graduating high school much less college. The desire to succeed is the driving force with college being just one more tool in a students arsenal. If the government pays for education the government can also institute testing to determine what a students best options are and from there assign jobs. While this is speculative at best turning over a persons individual future for a college tuition check is not necessarily the plan that supports freedom of choice.  The United States government already offers to pay for college for students who enlist in the military and serve their country. Military service and the G.I. Bill ensure that those who risk giving up their lives to protect their country are amply rewarded. In many other countries government service also provides a government paycheck and subsidization of education and more. Governmentfunded grant and loan programs also pay the way for many college students.  Going to college may not be optional but it remains a privilege that should be earned and should require sacrifice. Unfortunately one must only look at the public school system to see how easy it is to take the educational system for granted. The next time you wonder Should governments help pay for college? hopefully you can now better understand the complexities of the issue.
