4,23,2024,13,44
https://afsc.org/news/6-reasons-why-its-time-defund-police, Your commitment makes a difference! Give monthly to help communities meet urgent needs and make systemic change including in response to the climate crisis. 100 will be added to your gift when you become a Partner for Peace today.   Quaker action for a just world  Take the Pledge Think Twice Before Calling the Police In the aftermath of the police murder of George Floyd protests erupted in Minneapolis and across the U.S. with activists and community members demanding that Black lives matter and with many calling to defund the police.  Many of us particularly white people have been taught to equate policing with public safety and can t imagine alternatives to a punitive law enforcement model. But our criminal legal system was built to reinforce deep structural racism in our society. For most individuals and communities of color policing has brought terror rather than safety.  The murders of George Floyd Eric Garner Philando Castile Sandra Bland Michael Brown and countless other Black and Brown people at the hands of police are not anomalies. They are evidence of a racist system that disproportionately targets people of color for violence imprisonment and death. We need real change. That s why we must stop investing in police and incarceration and instead intentionally invest in alternative models that are centered in community and address the root causes of harm in addition to making greater investments in schools health care and other human needs that keep our communities safe.  Here is why we should all support the call to defund the police  The police are not a neutral body and the institution is inherently biased. In the U.S. slave patrols and night watches were the beginning of a racially directed system of law enforcement designed to secure capital for white settlers.  Over the past 40 years the expansion of racially targeted policing and policies such as stopandfrisk and the war on drugs have helped fuel mass incarceration in the U.S. with AfricanAmericans incarcerated at more than five times the rate of white people. Black and Brown people are disproportionately targeted from a young age with hundreds of thousands of children ages six to 14 arrested often by police officers stationed in schools as school resource officers.  Police forces have also become more militarized. Since 1990 the federal government has transferred 6 billion of excess military equipment to local law enforcement agencies under its 1033 Program giving police access to mineresistant vehicles assault rifles and grenade launchers. For years police have also undergone warrior training that teaches them to see every encounter as potentially lifethreatening especially when those encounters involve people of color. Every year onduty police kill an estimated 1000 people.  What s more a recent study revealed that hundreds of active duty officers from across the country are members of racist and antigovernment groups on Facebook. Despite the billions of dollars spent every year on policing more than 15000 people were killed by gun violence in 2019 alone disproportionately young people of color. If policing and imprisonment stopped violence the U.S. would be the most peaceful country in the world. But decades of evidence show us this is not the case.  If we believe in everyone s right to live in safety and peace we need to dismantle institutions that were never intended to get us there and free up resources for solutions that are actually designed to create healthy safe sustainable communities.  In Minneapolis and other U.S. cities body cameras and other reform measures were implemented as part of the Obama administration s multimilliondollar response to the call for police accountability and have proven largely ineffective.  Meanwhile police murders continue with 1002 people shot and killed by police already this year. U.S. cities collectively spend 100 billion a year on policing while needed investments in education health care housing and other critical programs go unfulfilled particularly in poor communities and communities of color. New York City for instance spends more on policing than it does on the Departments of Health Homeless Services Housing Preservation and Development and Youth and Community Development combined.  Our tax dollars must be reallocated from this system that regularly murders Black people with impunity and instead invested in programs that strengthen our communities.  As part of its platform the Movement for Black Lives calls for the reallocation of federal state and local government funds from policing and incarceration to longterm strategies for education restorative justice services and employment programs.  In Chicago the NoCopAcademy campaign galvanized thousands of community members and garnered the support of more than 100 community organizations in urging the city to shift funding for a new 95 million police academy to programs that benefit youth and communities.  Faced with budget shortfalls and urgent health care needs at least 13 cities have made cuts to their police budgets. That includes funding health care workers to respond to mental health emergencies instead of the police. It also means shifting our resources to transformative justice approaches that support survivors and work directly with the person who has caused harm through communitybased systems of accountability. Under these models community members work together to keep each other safe. The human costs of investing in policing instead of our communities have been social as well as financial. We have created a society that looks to policing as the answer to our problems both real and imagined calling the police not only in emergencies but also in response to white people s fears or annoyance in many situations where people of color are simply trying to live their lives.  Defunding police is one step we can take to free up resources and public imagination for more just and humane approaches to community safety and shared wellbeing. It s time to defund the police.  Mary Zerkel Mary Zerkel is the Associate Regional Director of the Midwest Region and Coordinator of Communities Against Islamophobia which works in partnership with the Muslim community to train allies to recognize and counter antiMuslim policies and practices with the long term goal of reducing profiling and surveillance of the Muslim community.  The AFSC newsletter connects activism to the issues that matter. Join us today. American Friends Service Committee1501 Cherry Street Philadelphia PA 191022152417000
https://www.britannica.com/story/pro-and-con-should-police-departments-be-defunded-if-not-abolished, To access extended pro and con arguments sources discussion questions and ways to take action on the issue of defunding the police go to ProCon.org. Amid the Black Lives Matter protests following the death of George Floyd in Minneapolis Minnesota on May 25 2020 calls to defund the police began to populate protest signs and social media posts.  While there are multiple interpretations of defund the police the basic definition is to move funding away from police departments and into community resources such as mental health experts housing and social workers. In the larger scope of the civil rights movement some advocates would reallocate some police funding but keep police departments others would combine defunding with other police reforms such as body cameras and bias training and others see defunding as a small step toward ultimately abolishing police departments and the prison system entirely.  According to the most recent data available police departments received about 114.5 billion nationwide in 2017 from state and local governments up from 42.3 billion in 1977. Police budgets have made up around 4 of total state and local budgets since 1977. About 97 of police budgets go toward operational costs such as salaries and benefits. However individual cities or counties may allocate more funds to police departments. The 2017 Los Angeles city budget for example provided 23 of the budget to police while 9 of Los Angeles county s budget went to policing.  64 of Americans oppose the abstract idea of defunding the police while 34 support the movement. 60 are against reallocating police budget funds to other public health and social programs while 39 are in favor.  In Oct. 2021 21 of American adults wanted police budgets increased a lot and 26 wanted budgets increased a little while 9 wanted police budgets decreased a little and 6 decreased a lot. 37 said budgets should stay about the same.  This article was published on January 20 2022 at Britannica s ProCon.org a nonpartisan issueinformation source. Go to ProCon.org to learn more.
https://www.thune.senate.gov/public/index.cfm/2021/7/demonizing-and-defunding-police-has-consequences, American communities are less safe today than they were a year ago. Crime rates have surged since defund the police became a rallying cry. It s no coincidence that cities that have slashed their police budgets have seen huge increases in violence. As of the end of May Portland Oregon was on track to exceed 1000 shootings for this year. In the first 14 weeks of 2021 New York City shootings were up 81 percent. In Oakland California carjackings are up almost 88 percent. Unfortunately these are just a few examples.  The crime surge is real and it is frightening. Statistics and percentages can seem abstract but there are people behind every one of those crimes. People whose lives have been cut short or ravaged by violence. People whose sense of safety has been destroyed. This won t be a surprise to most South Dakotans who overwhelmingly support our law enforcement officers but defunding the police is a terrible idea. Some of the cities that cut their own police funding are even recognizing the mistake they ve made and seeking to restore funding they cut. Unfortunately the problem won t necessarily be fixed that easily. Because the defund the police movement has not just resulted in smaller police budgets it has also resulted in lower police morale leading to a wave of police retirements and resignations. Now police departments are worried about having enough officers to keep their communities safe. It turns out that when you spend months vilifying police officers and demonizing them for doing their jobs some of them no longer want to stay. To me this is perhaps the worst consequence of the defund the police movement. Resources and equipment can be built back up again but it s a lot harder to replace good seasoned officers particularly right now when it s difficult to imagine why anyone would want to become a police officer. Why would men and women sign up for a job where they are regularly characterized as the worst kind of criminals? The sickening scene of protesters shouting death to police outside a hospital where two ambushed law enforcement officers were fighting for their lives has to be emblazoned on the minds of police officers nationwide. The defund the police movement unjustly paints the entire law enforcement community as corrupt and immoral. We all know that simply isn t true. Police officers are heroes in their communities brave and committed Americans who put on the badge each day knowing the risk to their own safety. These are the people we call when we have a car accident see someone in trouble or in need or fear for our safety. These are the people who run toward danger and violence when the natural reaction is to run away from it. Our law enforcement officers deserve the highest level of respect. Now are there bad police officers out there? Of course there are. There are bad teachers out there too. And bad social workers. And bad businessmen. But just as it would be outrageous to demonize all teachers because of the few bad apples in their profession it is outrageous to demonize the hundreds of thousands of dedicated Americans defending public safety because of a handful of bad officers.  We owe our men and women in law enforcement a great debt a debt we can t even fully comprehend. These men and women go out and risk their lives every day of the week every month of the year to keep us safe. And they bear a heavy physical and emotional burden. It s tough to have to see evil on a daily basis to spend years rescuing children who are in trouble or supporting victims of violence or bringing rapists to justice. They confront violence so that we don t have to and they pay a price. We owe them and their families our profound gratitude.  Democrats bear a substantial amount of responsibility for this situation. Far too many of them actively supported the defund the police movement and encouraged resentment toward law enforcement. It is disgraceful that antipolice rhetoric has become such an accepted part of our national conversation and has been winked at or endorsed by so many Democrat leaders. We owe our police officers much better. If any good can come out of all this violence and heartbreak I hope it s increased recognition of how essential police officers are to keeping our communities safe and a rejection of any idea of defunding the police. It s time to focus on protecting public safety and honoring the men and women who spend every day working to promote it.  Permalink httpswww.thune.senate.govpublicindex.cfm20217demonizinganddefundingpolicehasconsequences
https://www.brookings.edu/articles/7-myths-about-defunding-the-police-debunked/, Election 24U.S. Economy U.S. Economy U.S. Economy Banking Finance Economic Indicators Federal Fiscal Policy Federal Reserve Labor Unemployment Regulatory Policy Retirement Social Safety Net State Local Finance U.S. Trade Policy Explore topic What can be done about the high and rising national debt? What can be done about the high and rising national debt? The changing demographics of business ownership The changing demographics of business ownership The safety net should work for workingage adults The safety net should work for workingage adults International Affairs International Affairs International Affairs Democracy Conflict Governance Diplomacy Multilateralism Foreign Politics Elections Fragile States Geopolitics Humanitarian Disaster Assistance Migrants Refugees Internally Displaced Persons Trafficking Illicit Trade U.S. Foreign Policy Explore topic Don t relax Europe the US hard right isn t finished yet Don t relax Europe the US hard right isn t finished yet Will South Korea change course following Yoon s election loss? Will South Korea change course following Yoon s election loss? South Africa AGOA and nonalignment South Africa AGOA and nonalignment Technology Information Technology Information Technology Information Artificial Intelligence Cryptocurrency Cybersecurity Internet Telecommunications Media Journalism Privacy Social Media Space Exploration Technology Policy Regulation Explore topic The criminalization of abortion and surveillance of women in a postDobbs world The criminalization of abortion and surveillance of women in a postDobbs world Robots make your work less meaningful Robots make your work less meaningful Emerging technologies and geopolitical divides The transformation of the USJapan alliance Emerging technologies and geopolitical divides The transformation of the USJapan alliance Race in Public Policy Race in Public Policy Society Culture Children Families Crime Justice Safety Demographics Population Economic Security Mobility Human Rights Civil Liberties Immigrants Immigration Race in Public Policy Religion Society Social Equity Inclusion Explore topic Protecting civil rights in the face of AI The TechTank Podcast Protecting civil rights in the face of AI The TechTank Podcast Supporting a communityled data infrastructure to build local and equitable governance that advances policy Supporting a communityled data infrastructure to build local and equitable governance that advances policy Gentrification s impact on school demographics A study of 3 California cities Gentrification s impact on school demographics A study of 3 California cities Topics Business Workforce Cities Communities Climate Energy Defense Security Education Global Economy Development Health Care International Affairs Society Culture Technology Information U.S. Economy U.S. Government Politics Regions Africa Asia the Pacific Eurasia Europe Latin America the Caribbean Middle East North Africa North America SearchHomeElection 24U.S. EconomyInternational AffairsTechnology InformationRace in Public PolicyAll TopicsAll RegionsExpertsEventsResearch ProgramsAbout UsResearch CommentaryNewslettersCareersFor Media Search Home 7 myths about defunding the police debunked Sections Sections Share Share Search Sections Sections Share Share Subscribe to How We RiseSign Up Commentary  hhendersonphd  Governance Studies Race Prosperity and Inclusion Initiative Policing in the U.S. is a highly politicized issue with a history intertwined with racial and classbased struggle. During the summer of 2020 no issue was debated more than the subject of defunding the police. The phrase defund the police DTP became a rallying cry for the progressive left. Yet while the movement gained considerable news coverage the two major political parties media and major presidential candidates labeled defunding the police as an unrealistic demand. This mischaracterization of the movement is not based on fact but rather fear. In this article we address seven common myths associated with the campaign with the goal to demonstrate that while some have labeled it a radical movement the DTP philosophy is based on wellresearched evidencebased positions.  One of the most misleading critiques of the movement is instigating defund means abolish. Opposers claim the movement undermines public safety through its efforts to end policing. The truth the movement seeks to demilitarize police departments and reallocate funding to trained mental health workers and social workers to reduce unnecessary violent encounters between police and citizens. At least 13 cities in the United States have currently engaged in policy programs to defund the police. Another misconception is that police forces are what maintains order. However studies have found that the best tools to establish peaceful societies are equity in education and infrastructure. Indeed research shows that lack of education and illiteracy are some of the most significant predictors of future prison populations. Myth 3 Police Protect the Public From Violence Critics of the police movement assert that we need heavily funded and armed police forces to protect the public from violent criminal elements. However there isn t sufficient data to support that position. In fact research has found that the police don t have a notoriously efficient track record of solving violent crime. Further what the research does show is that 70 of robberies 66 of rapes 47 of aggravated assaults and 38 of murders go unsolved each year. Myth 4 Community Programs Won t Work While much of the available research contradicts the narrative that policing is essential to eliminating crime substantial evidence shows that investing developing and supporting education and economic programs do in fact lead to less offenses and create more social harmony. Education has long been viewed as the great equalizer. Data supports the position that individuals that receive a quality education are less likely to become involved in the criminal justice system. Myth 5 Most Police Work is Focused on Crime Prevention There is minimal evidence that police surveillance results in reduced crime or prevents crime. For instance research showed 90 of the people that were stopped in the NYPD s controversial stop and frisk program were not committing any crime. While it is true that police do apprehend individuals that violate the law this is one of several components of their responsibilities. Myth 6 Police Officers Do Not Need College Degrees Research shows police officers that have at least two years of a college education are less likely to have misconduct complaints and less likely to use force to gain compliance. And officers with only high school diplomas account for 75 of disciplinary problems. The evidence shows reform efforts should not ignore the application pool crisis and law enforcement departments should instill more robust higher education standards. Myth 7 Defunding the Police is a KneeJerk Reaction With No Research Some opponents of cutting police budgets view the movement as an emotional response to police misconduct rather than a wellthoughtout campaign. However a study with 60 years of data indicates that increases in spending do not reduce crime. Which begs the question how is 60 years of a failed objective any better? Yes the movement gained attention because of tragic events in 2020 but the evidence supporting the movement is based on hard data and proven methods. Police reform is long overdue and we have had thousands of opportunities to make the appropriate changes. In 2020 the murder of George Floyd garnered national attention that has caused many to take a long hard look at our democratic systems cultural identities and the necessary steps towards equal protection. We do know that more traditional policing is not the answer. No matter what we choose to call it defund the police a reallocation of funding or a total reimagination research supports a public health approach to policing. If we are effective funding public health approaches will reduce the reliance on lawandorder policing save lives and reverse the longstanding slide in the wrong direction. Police must be the last resort used only when necessary to protect the public from harm. Until then municipalities will need to prepare for the impact of increased police accountability and transparency. Ultimately the rising costs associated with police misconduct will force police reform a cost that would have been much cheaper had we listened to those groups most impacted by aggressive policing. To see real change in our society policymakers must remove the barriers and fund necessary programming. We need not raise taxes. We simply need to be smart and follow the science.   Rashawn Ray   Howard Henderson   Brandon P. Ruben   hhendersonphd   SubTopics Crime Justice Safety Race in Public Policy  Governance Studies Race Prosperity and Inclusion Initiative  Ruchi Saini   John Hudak   John Hudak Fred Dews  Get the latest from Brookings Sign Uptwitter facebooklinkedinyoutubeinstagramThe Brookings Institution is a nonprofit organization based in Washington D.C. Our mission is to conduct indepth nonpartisan research to improve policy and governance at local national and global levels.
