4,23,2024,13,21
https://www.nbcnews.com/news/latino/court-ruling-daca-illegal-program-hasnt-ended-4-things-know-rcna105085, U.S. District Judge Andrew Hanen ruled Wednesday night that recent efforts by the Biden administration to turn the Obamaera program into a federal regulation were unlawful.  The ruling was deeply upsetting Areli Hernandez a longtime DACA recipient from Los Angeles and the director of executive affairs at the immigrant rights organization CHIRLA said at a news briefing Thursday organized by several immigrant and civil rights groups. Former DACA recipient Bruna Sollod a senior political director at United We Dream the country s largest immigrant youthled organization said Imagine hundreds of thousands of young people who have jobs right now have mortgages car payments small businesses and clients that rely on them. That has a huge impact on the economy and on communities across this country.   I don t know what else we need to say to make elected officials and the Biden administration understand the threat that we are facing Sollod said.  The programs fate is still uncertain as the sixyear court battle continues to play out in courts after legal challenges from the Trump administration and nine Republicanled states seeking to fully end DACA.  Here are four important things to know about who is affected and whats at stake. While the roughly 580000 current recipients can continue to renew their DACA status every two years the program is closed for new applicants. While Hanen whom President George W. Bush nominated in 2002 has ruled DACA illegal multiple times he has refrained from fully terminating it. The latest ruling continues to allow DACA recipients to file renewal applications while the case is pending appeal said Andrea Senteno the regional counsel at the Mexican American Legal Defense and Educational Fund better known as MALDEF. MALDEF has been representing 22 DACA recipients since 2018 in the legal challenge brought by the Republicanled states of Alabama Arkansas Kansas Louisiana Mississippi Nebraska South Carolina Texas and West Virginia. Alongside attorneys from the federal government and New Jersey MALDEF has argued that the states have failed to prove injuries from DACAs implementation and that the initiative is a lawful exercise of presidential discretion Senteno said. In 2020 the Supreme Court ruled 54 that the Trump administration improperly ended DACA in 2017 allowing it to stay in place. They wont lose their status as long as they continue to renew their DACA in a timely manner. Current recipients or those whose DACA status expired less than a year ago can continue to renew it every two years. Those who miss the window to renew would be able to reapply only as new applicants but that isn t currently allowed.  Sometimes people fall out of the DACA status because they don t renew on time due to finances or due to the inability to access the correct legal resources Hernandez said. Unfortunately this decision from Judge Hanen also affects those who were not able to renew their DACA with sufficient time.  An estimated 400000 people who would have been eligible to apply for the first time haven t had access to DACA since 2021 according to an analysis by FWD.us a bipartisan group supporting immigration reform. Among the 400000 people shut out of the DACA program are nearly 93000 firsttime applicants who have been left in limbo for the past two years. They had submitted the necessary paperwork and paid the required 495 fee to apply for the program shortly before Hanen closed it for new applicants. Since DACA started in 2012 recipients have contributed 108 billion to the economy as well as 33 billion in combined taxes according to FWD.us.  It strengthens our economy our communities and provides a way for people who came as children to work study live their lives and support their families said Vanessa C rdenas the executive director of the immigrant advocacy organization America s Voice.  An overwhelming majority of DACA recipients were born in Mexico followed by other Latin American countries according to U.S. Citizenship and Immigration Services. A smaller but significant number are from Asian countries such as the Philippines India Pakistan and Indonesia.  Hanen s ruling is likely to be appealed to the Supreme Court sending DACA before the court for a third time. As of Thursday afternoon MALDEF had no timeline for the appeals process. Senteno said it is reviewing closely the decision and preparing and discussing what the next steps will be alongside attorneys from the federal government and those representing plaintiffs in New Jersey. In the meantime DACA recipients and immigrant rights advocates have continued to push for a pathway to citizenship.  We need a permanent solution that will recognize our humanity our roots and our contributions to this nation Hernandez said. Sen. Alex Padilla DCalif. introduced a bill in July that could provide permanent residency or green cards to more than 8 million noncitizens by updating a provision in the Immigration and Nationality Act known as registry. That would allow immigrants who have been continuously present in the U.S. for at least 7 years to apply for permanent residency. A House version of the bill was introduced this year. Glo Choi a community organizer at HANA Center a nonprofit group advocating for Koreans Asian American and immigrant communities said he believes the bills are the best option to provide legal status to DACA recipients and other kinds of undocumented immigrants. We believe that all of us are deserving of living free with dignity in the place that we call home Choi said. A bill reintroduced by Rep. Sylvia Garcia DTexas in June seeks to provide a pathway to citizenship for DACA recipients and other immigrants with other kinds of immigration protections. Versions of the bill passed in the House last year and in 2021 C rdenas said adding it could pass it again if at least nine Republicans support it alongside Democrats. Supporters of DACA say it s one of the most successful policies for immigrant integration. Most DACA recipients have lived in the U.S. for more than 16 years.   They are no longer kids. They are raising families of their own and are well into their careers C rdenas said. The average DACA recipient is 26 to 28 years old said Gaby Pacheco the director of advocacy development and communications at TheDream.Us an organization helping young immigrants complete college.  Those who are at the top of the DACA population are now in their early 40s Hernandez said. And those who are in their mid to early 20s can t access DACA anymore.  DACA recipients are also parents to more than 200000 U.S. citizen children. Among them is Angel Reyes a DACA recipient from Long Island who is an organizing coordinator at Make the Road New York.  That s what I m thinking about the most Reyes said. Without a permanent solution to regulate the immigration status of DACA recipients Reyes fears he could be separated from his two U.S. citizen children. That fear brings him back to when he was a 17yearold in high school and his mother was deported to Peru.  That was one of the most difficult moments that I experienced if not the most difficult moment I experienced in my life said Reyes who is also a business owner. Nicole AcevedoNicole Acevedo is a reporter for NBC News Digital. She reports writes and produces stories for NBC Latino and NBCNews.com. AboutContactHelpCareersAd ChoicesPrivacy PolicyDo Not Sell My Personal InformationCA NoticeTerms of Service Updated JULY 7 2023NBC News SitemapClosed CaptioningAdvertiseSelect ShoppingSelect Personal Finance 2024 NBC UNIVERSAL
https://www.fwd.us/news/what-if-daca-ends/, Despite DACA s overwhelming success the future of the policy and the Dreamers protected by it is facing urgent legal threats. A federal judge in Texas ruled in 2021 that the DACA policy is unlawful barring the government from accepting new applications for now current DACA holders are still permitted to renew their status every two years as outlined by the original policy. In October the Court of Appeals for the Fifth Circuit agreed with the lower court s decision finding the DACA policy is unlawful but permitted renewals to continue while the Texas court reviews the case again. As DACA continues to be litigated in the courts analysis by FWD.us makes clear the severe damage to the U.S. economy and to millions of U.S. families that would occur if DACA ends or if DACA renewals are not allowed to continue.1 A critical aspect of DACA and a driving force for much of its success is that DACA provides recipients access to employment authorization documents allowing them to pursue employment in the United States as well as making them eligible for certain benefits like a driver s license. If DACA ended or renewals were restricted current DACA recipients would lose their work authorization and all ancillary privileges that allow them to travel safely and take care of vital daily activities like driving their kids to school or taking family members to doctor s visits. Because DACA renewals are granted on a rolling basis local communities would almost immediately feel the impact if renewals were blocked. An estimated 22000 jobs would be lost each and every month for two years about 1000 jobs each business day at a time when workforce shortages are already hurting families and driving up costs across the country. If DACA renewals are halted this means that each month for two years some 1600 DACA recipients working in healthcare including doctors and nurses 800 educational professionals like teachers and teacher aides and 600 personal care workers in child or senior care would be forced out of their jobs which would be devastating to communities across the country. Even now the number of people protected by DACA is shrinking. The policy is closed to new applications due to legal challenges prohibiting nearly 400000 Dreamers who should be eligible to receive DACA protections from applying for them. For example some 93000 new initial applications for DACA are pending adjudication at United States Citizenship and Immigration Services because their processing has been halted by the courts. Currently only renewals are being processed and even then the rules for age and arrival date have remained unchanged for more than a decade meaning the DACA policy is largely frozen to new applicants. Consequently while DACA recipients who received protections early on many as students are now building careers the postDACA generation of Dreamers is entering adulthood with far fewer opportunities. For example FWD.us estimates that only a quarter of the 100000 undocumented high school graduates in 2022 would be eligible for DACA if new applications were being processed. California and Texas home to the highest numbers of DACA recipients would suffer the highest number of job losses if DACA ended with an estimated 6000 monthly job losses in California and 5000 in Texas. In Texas this means 400 healthcare workers and 300 teachers would be forced out of their jobs each month. Among other top states of DACA recipients the monthly job losses would amount to 1000 individuals in Illinois 800 in New York 800 in Arizona 700 each in Florida and North Carolina 600 in Georgia and 500 each in Washington and Colorado with terrible ripple effects for DACA recipients families and broader communities. Because the DACA renewal period is 24 months job losses would continue and compound over those two years. When the last DACA recipient s work permit expires the U.S. will have lost more than half a million jobs and the U.S. economy will lose as much as 11.7 billion annually or roughly 1 billion monthly in wages from previously employed DACA recipients. Economic losses from DACA s ending would represent only the tip of the iceberg. Because most DACA recipients have lived in the U.S. for two decades or more losing DACA would hurt families across the country with farreaching harm for nearly every community in the U.S. DACA recipients have deep roots in their local communities. Most are in their thirties or will soon be approaching them. They own homes here have started businesses and are raising their kids and building their families. Critically many DACA recipients have children and spouses who are U.S. citizens. If DACA renewals were halted DACA recipients could lose their protections from deportation putting them at immediate risk. This means an estimated 25000 U.S. citizen children each month would be living with a parent at risk of being torn from their families and deported to a country they likely don t even remember. Similarly an estimated 5000 U.S. citizens have a spouse who would lose deportation protections. This means each day for two years nearly 1000 immediate U.S. citizen family members will see a loved one at immediate risk of deportation. This would mean 6000 U.S. citizen children in California and a further 5000 in Texas would have a parent becoming eligible for deportation each month for two years. It would mean that each month for two years 1500 U.S. citizen spouses of DACA recipients in California and 1000 in Texas could see their spouses deported. Even these large numbers tell only part of the story. Living with the threat of deportation places an enormous burden on family members and children compromising their ability to concentrate at work or school and adding terrible stress and fear to their daily lives. The threat to DACA recipients is real and it s right in front of us. While Dreamers have long been stuck in a precarious position the current legal threats to DACA have put the policy in greater danger than ever. Congress must pass a permanent legislative solution in 2022 to protect Dreamers or Dreamers futures in this country and the futures of their families and communities will be in great peril. Ending DACA would severely damage businesses across the country. Hospitals would be unable to serve as many patients. Classrooms would lose their teachers. And families of all backgrounds would experience the enormous stress of losing loved ones to deportation. DACA faces the imminent risk of being ended threatening the lives of hundreds of thousands of young people. It is imperative that eligible DACA recipients continue to renew their DACA as soon as possible and that Congress act this year. We urge all parties to do their part to support these crucial efforts.
https://www.colorado.edu/today/2023/09/20/what-latest-daca-ruling-means-program-and-its-dreamers,  Skip to Content  March and rallyprotest in response to the rescission of Deferred Action For Childhood Arrivals DACA in New York City on Sept. 9 2017 Credit Wikimedia Commons  On Sept. 13 a federal judge again declared the Deferred Action for Childhood Arrivals program or DACA illegal. The ruling does not end the program but extends an already yearslong legal battle over its existence.  Current DACA recipients are still eligible to reapply for the legal protections that allow them to stay and work in the United States. New applications remain halted stuck in limbo since 2021. The ruling will likely be appealed to the U.S. Supreme Court.  Pratheepan Deep Gulasekaram a professor of constitutional law and immigration law at CU Boulder studies the constitutional rights of noncitizens and has written multiple books on immigration policy. Gulasekaram offers his take on what this latest ruling means for DACA recipients and the state of immigration in the United States.   DACA was announced by the Obama administration back in 2012. At that time Barack Obama s administration was already creating enforcement priorities for immigration which are guidelines for Immigrations and Customs Enforcement. Those guidelines classified people who were young who were students or who had no felony background as the lowest priority for deportation.  Despite the publication of these priorities many people who fell under lowpriority were still caught up in ICE s enforcement dragnet. So in 2012 Obama announced the creation of the DACA program. DACA created a set of eligibility criteria that if met allowed young undocumented people to apply for deferred action shielding them from deportation for two years. Further recipients could apply to renew their DACA grant after that initial period. Importantly at that time DACA was created as a memorandum from the Secretary of Homeland Security. Something that wasn t specifically listed in the memorandum but is immensely important to the importance of DACA and current litigation about the programs legality is work authorization. Once someone has deferred action they can apply to receive authorization to work during the time they maintain DACA. DACA was not challenged for quite some time really until near the beginning of President Donald Trump s administration. The state of Texas along with several other states with Republican governors or attorneys general challenged the program in a federal district court in Texas. That court was specifically chosen for the judge U.S. District Judge Andrew Hanen because he had previously ruled on and rejected an extension of DACA that Obama tried to enact several years before.  Hanen ruled that DACA was illegal in part because of the way it was created as a memorandum from the Department of Homeland Security and not a more involved process that complies with procedural rules and philosophy that usually accompany action from a federal agency. Despite finding DACA unlawful and preventing DHS from processing new applications however Hanen s ruling permitted those already with DACA to keep it and to seek renewal with DHS. Fast forward to 2021 when incoming President Joe Biden asked his Secretary of Homeland Security to shore up DACA by enacting through formal agency rulemaking. At that time Hanen s ruling was on appeal with the 5th Circuit Court of Appeals. Noting that Biden s DHS had codified DACA through the formal rulemaking process the 5th Circuit kicked the case back down to Hanen to see if the codification of DACA altered the legality of the program. Hanen ruled that it did not. And so issued the ruling we have from Sept. 13 where he concludes the program is still illegal.  Importantly however just as with his initial ruling the most recent decision does not strip current DACA recipients of the program s protections and appears to still allow DACA renewals. And as with the prior ruling the federal government cannot process any new applications.  The Biden administration will no doubt appeal Hanen s ruling up to higher federal courts. Anybody who knows anything about immigration and the 5th Circuit Court of Appeals one of the most if not the most reactionary and conservative courts in the nation expects with near certainty that it will very quickly approve of and affirm Hanen s ruling. In the past the 5th Circuit has found extensions of the DACA program illegal and more generally has upheld enforcementheavy immigration policies. In fact given the 5th Circuit s track record a panel of judges might take it upon themselves to go even further than Hanen s ruling. For example they could agree that DACA is illegal and add that current recipients cannot continue to defer deportation. No matter what happens after the 5th Circuit ruling the White House will likely very quickly appeal to the Supreme Court.  Of course the makeup of the Supreme Court looks very different than it did when DACA started. Justices Ruth Bader Ginsberg Stephen Breyer and Anthony Kennedy are no longer on the court. It s much more likely the court has at least five votes and perhaps six to agree that DACA is illegal if the justices agree to take the case.  Then the question becomes What do we tell young undocumented people who have been here for years who ve studied and earned degrees at schools in the United States who know of no other country but this one and who were for the last decade gainfully employed or serving in our military? That s hundreds of thousands of people who currently have DACA status.  First the timing of potential litigation matters. If Biden is still in office the administration will appeal. It s hard to say if someone else in the office especially a Republican and specifically Donald Trump who previously attempted to rescind DACA would do the same.  It s also important to note that DACA recipients in particular and Dreamers in general have garnered a lot of sympathy amongst the American public. These are young people brought to the United States and its become a very popular program which is something candidates and Congress as well should consider. DREAM Act legislation is overwhelmingly popular with American voters but has thus far failed to pass in Congress.  If it is your belief that somehow removing DACA or any such protection is magically going to help with immigration enforcement it won t. There are 11 million people without lawful status in the United States. It s a false choice to believe that removing DACA protection will reduce that number or that people will somehow stop entering or remaining in the country unlawfully.  Ultimately if we dont find a solution not just for DACA recipients but for the unlawfully present population in general we are just going to deepen the immigration problem that we already have in the United States.  CU Boulder Today regularly publishes Q As with our faculty members weighing in on news topics through the lens of their scholarly expertise and researchcreative work. The responses here reflect the knowledge and interpretations of the expert and should not be considered the university position on the issue. All publication content is subject to edits for clarity brevity and university style guidelines. Subscribe to CUBT Sign up for Alerts Administrative eMemos Buff Bulletin Board Events Calendar Submit a Story Editorial Guidelines FacultyStaff Email Archive Student Email Archive Graduate Student Email Archive New Buffs Email Archive Forever Buffs Email Archive Email your feedback for CU Boulder Today.CU Boulder Today is created by Strategic Relations and Communications.  University of Colorado Boulder Regents of the University of Colorado Privacy Legal Trademarks Campus Map
